<?xml version="1.0" encoding="UTF-8"?>

<!-- Skeleton with CV_1.xsd (schema) -->
<!DOCTYPE CV SYSTEM "CV_1.dtd">
<CV xmlns:xsi="http://www.w3.org/2001/XMLSchema-instance" xsi:noNamespaceSchemaLocation="CV_1.xsd">
<header>
    <name>Maricic Alexandre</name>
    <email>maricic.alexandre@gmail.com</email>
    <address>Drancy</address>
</header>
  <summary>
    <summary_headline>L3 Étudiant</summary_headline>
    <summary_description>Étudiant en L3 Informatique a l'université Sorbonne Paris Nord.</summary_description>
  </summary>
  <experience>
    <job>
      <job_title>Stage</job_title>
      <job_company>Mairie de Drancy</job_company>
      <job_dates>Dec. 2014 - Janv. 2015</job_dates>
      <job_description>Assistant technicien.</job_description>
    </job>
  </experience>
  <education>
    <degree>
      <degree_title>BAC</degree_title>
      <degree_institution>Lycée Eugène Delacroix</degree_institution>
      <degree_dates>2018</degree_dates>
    </degree>
    <degree>
      <degree_title>Licence</degree_title>
      <degree_institution>Université Sorbonne Paris Nord</degree_institution>
      <degree_dates>2018-présent</degree_dates>
    </degree>
  </education>
  <langues>
  	<langue>Anglais - Niveau C1</langue>
  	<langue>Serbe - Langue maternelle</langue>
  	<langue>Espagnol - Niveau A2</langue>
  </langues>
  <skills>
    <skill>C</skill>
    <skill>HTML</skill>
    <skill>CSS</skill>
    <skill>JavaScript</skill>
    <skill>Python</skill>
    <skill>SQL</skill>
  </skills>
  <loisir>
    <activite>Basketball</activite>
    <activite>Auto-Mobile</activite>
  </loisir>
</CV>
